{
  "apiVersion": 1,
  "architecture": "windows-x64",
  "id": "example.hello",
  "version": "1.0.0",
  "entry": "hello.dll",
  "name": "Hello plugin",
  "contributions": [
    {"id": "hello", "kind": "menu", "title": "Hello", "command": "hello"},
    {"id": "status", "kind": "widget", "title": "Hello", "command": "hello"}
  ]
}
